{
  "$schema": "https://json-schema.org/draft/2020-12/schema",
  "title": "Devil's Table stock profiles v1",
  "type": "object",
  "additionalProperties": false,
  "required": [
    "schemaVersion",
    "oftenChance",
    "rarelyChance",
    "profiles"
  ],
  "properties": {
    "schemaVersion": {
      "type": "integer",
      "const": 1
    },
    "oftenChance": {
      "type": "integer",
      "minimum": 1
    },
    "rarelyChance": {
      "type": "integer",
      "minimum": 1
    },
    "profiles": {
      "type": "array",
      "minItems": 1,
      "items": {
        "type": "object",
        "additionalProperties": false,
        "required": [
          "id",
          "shop",
          "coverage",
          "draws",
          "categoryDraws",
          "categories",
          "overrides"
        ],
        "properties": {
          "id": {
            "type": "string",
            "pattern": "^DT_TABLE_[A-Z0-9]+(?:_[A-Z0-9]+)*$"
          },
          "shop": {
            "type": "string",
            "pattern": "^[a-z0-9]+(?:-[a-z0-9]+)*$"
          },
          "coverage": {
            "type": "string",
            "enum": [
              "complete",
              "partial"
            ]
          },
          "draws": {
            "type": "integer",
            "minimum": 1
          },
          "categoryDraws": {
            "type": "integer",
            "minimum": 1
          },
          "categories": {
            "type": "array",
            "uniqueItems": true,
            "items": {
              "type": "string",
              "pattern": "^[a-z0-9]+(?:-[a-z0-9]+)*$"
            }
          },
          "overrides": {
            "type": "array",
            "items": {
              "type": "object",
              "additionalProperties": false,
              "required": [
                "itemId",
                "tier"
              ],
              "properties": {
                "itemId": {
                  "type": "string",
                  "pattern": "^DT_ITEM_[A-Z0-9]+(?:_[A-Z0-9]+)+$"
                },
                "tier": {
                  "type": "string",
                  "enum": [
                    "always",
                    "often",
                    "rarely"
                  ]
                }
              }
            }
          },
          "variants": {
            "type": "array",
            "items": {
              "type": "object",
              "additionalProperties": false,
              "required": [
                "id",
                "name",
                "description",
                "draws",
                "categoryDraws",
                "excludedItems",
                "overrides",
                "merchantNotes"
              ],
              "properties": {
                "id": {
                  "type": "string",
                  "pattern": "^DT_TABLE_[A-Z0-9]+(?:_[A-Z0-9]+)*$"
                },
                "name": {
                  "type": "string",
                  "minLength": 1,
                  "maxLength": 200,
                  "pattern": "\\S"
                },
                "description": {
                  "type": "string",
                  "minLength": 1,
                  "maxLength": 2000,
                  "pattern": "\\S"
                },
                "draws": {
                  "type": "integer",
                  "minimum": 1
                },
                "categoryDraws": {
                  "type": "integer",
                  "minimum": 1
                },
                "excludedItems": {
                  "type": "array",
                  "uniqueItems": true,
                  "items": {
                    "type": "string",
                    "pattern": "^DT_ITEM_[A-Z0-9]+(?:_[A-Z0-9]+)+$"
                  }
                },
                "overrides": {
                  "type": "array",
                  "items": {
                    "type": "object",
                    "additionalProperties": false,
                    "required": [
                      "itemId",
                      "tier"
                    ],
                    "properties": {
                      "itemId": {
                        "type": "string",
                        "pattern": "^DT_ITEM_[A-Z0-9]+(?:_[A-Z0-9]+)+$"
                      },
                      "tier": {
                        "type": "string",
                        "enum": [
                          "always",
                          "often",
                          "rarely"
                        ]
                      }
                    }
                  }
                },
                "merchantNotes": {
                  "type": "object",
                  "additionalProperties": false,
                  "required": [
                    "alwaysStocks",
                    "oftenStocks",
                    "rarelyStocks"
                  ],
                  "properties": {
                    "alwaysStocks": {
                      "type": "array",
                      "minItems": 1,
                      "uniqueItems": true,
                      "items": {
                        "type": "string",
                        "minLength": 1,
                        "maxLength": 300,
                        "pattern": "\\S"
                      }
                    },
                    "oftenStocks": {
                      "type": "array",
                      "minItems": 1,
                      "uniqueItems": true,
                      "items": {
                        "type": "string",
                        "minLength": 1,
                        "maxLength": 300,
                        "pattern": "\\S"
                      }
                    },
                    "rarelyStocks": {
                      "type": "array",
                      "minItems": 1,
                      "uniqueItems": true,
                      "items": {
                        "type": "string",
                        "minLength": 1,
                        "maxLength": 300,
                        "pattern": "\\S"
                      }
                    }
                  }
                },
                "quantityLimit": {
                  "type": "integer",
                  "minimum": 1,
                  "maximum": 100
                },
                "tierChances": {
                  "type": "object",
                  "additionalProperties": false,
                  "required": [
                    "often",
                    "rarely"
                  ],
                  "properties": {
                    "often": {
                      "type": "integer",
                      "minimum": 0,
                      "maximum": 100
                    },
                    "rarely": {
                      "type": "integer",
                      "minimum": 0,
                      "maximum": 100
                    }
                  }
                },
                "offerRules": {
                  "type": "array",
                  "items": {
                    "type": "object",
                    "additionalProperties": false,
                    "required": [
                      "tag",
                      "visibility"
                    ],
                    "properties": {
                      "tag": {
                        "type": "string",
                        "pattern": "^[a-z0-9]+(?:-[a-z0-9]+)*$"
                      },
                      "visibility": {
                        "type": "object",
                        "additionalProperties": false,
                        "required": [
                          "mode"
                        ],
                        "properties": {
                          "mode": {
                            "type": "string",
                            "enum": [
                              "public",
                              "hidden",
                              "relationship"
                            ]
                          },
                          "minPurchases": {
                            "type": "integer",
                            "minimum": 1,
                            "maximum": 1000000
                          },
                          "revealed": {
                            "type": "boolean"
                          }
                        }
                      }
                    }
                  }
                }
              }
            }
          },
          "quantityLimit": {
            "type": "integer",
            "minimum": 1,
            "maximum": 100
          },
          "tierChances": {
            "type": "object",
            "additionalProperties": false,
            "required": [
              "often",
              "rarely"
            ],
            "properties": {
              "often": {
                "type": "integer",
                "minimum": 0,
                "maximum": 100
              },
              "rarely": {
                "type": "integer",
                "minimum": 0,
                "maximum": 100
              }
            }
          },
          "offerRules": {
            "type": "array",
            "items": {
              "type": "object",
              "additionalProperties": false,
              "required": [
                "tag",
                "visibility"
              ],
              "properties": {
                "tag": {
                  "type": "string",
                  "pattern": "^[a-z0-9]+(?:-[a-z0-9]+)*$"
                },
                "visibility": {
                  "type": "object",
                  "additionalProperties": false,
                  "required": [
                    "mode"
                  ],
                  "properties": {
                    "mode": {
                      "type": "string",
                      "enum": [
                        "public",
                        "hidden",
                        "relationship"
                      ]
                    },
                    "minPurchases": {
                      "type": "integer",
                      "minimum": 1,
                      "maximum": 1000000
                    },
                    "revealed": {
                      "type": "boolean"
                    }
                  }
                }
              }
            }
          }
        }
      }
    }
  }
}
