{
  "schemaVersion": 1,
  "oftenChance": 80,
  "rarelyChance": 15,
  "profiles": [
    {
      "id": "DT_TABLE_TAV",
      "shop": "tavern",
      "coverage": "complete",
      "draws": 16,
      "categoryDraws": 3,
      "categories": [
        "ale",
        "beer",
        "mead",
        "wine",
        "spirits",
        "non-alcoholic-drinks",
        "hot-drinks",
        "breakfast",
        "lunch",
        "dinner",
        "stews",
        "roasts",
        "bread",
        "cheese",
        "desserts",
        "snacks",
        "travel-meals",
        "luxury-meals",
        "animal-feed",
        "animal",
        "camping",
        "containers",
        "fire-lighting",
        "household",
        "rope-climbing",
        "travel",
        "imported-drinks",
        "soups",
        "fish",
        "tavern-supplies"
      ],
      "overrides": [
        {
          "itemId": "DT_ITEM_GS_BARREL",
          "tier": "often"
        },
        {
          "itemId": "DT_ITEM_GS_BASKET",
          "tier": "often"
        },
        {
          "itemId": "DT_ITEM_GS_BOTTLE",
          "tier": "often"
        },
        {
          "itemId": "DT_ITEM_GS_FLASK",
          "tier": "often"
        },
        {
          "itemId": "DT_ITEM_GS_JUG_CLAY",
          "tier": "often"
        },
        {
          "itemId": "DT_ITEM_GS_JAR_CERAMIC",
          "tier": "often"
        },
        {
          "itemId": "DT_ITEM_GS_TORCH",
          "tier": "often"
        },
        {
          "itemId": "DT_ITEM_GS_CANDLE",
          "tier": "often"
        },
        {
          "itemId": "DT_ITEM_GS_CANDLE_BEESWAX",
          "tier": "often"
        },
        {
          "itemId": "DT_ITEM_GS_CANDLE_TALLOW",
          "tier": "often"
        },
        {
          "itemId": "DT_ITEM_GS_LANTERN",
          "tier": "often"
        },
        {
          "itemId": "DT_ITEM_GS_LAMP",
          "tier": "often"
        },
        {
          "itemId": "DT_ITEM_GS_OIL_LAMP",
          "tier": "often"
        },
        {
          "itemId": "DT_ITEM_GS_TINDERBOX",
          "tier": "often"
        },
        {
          "itemId": "DT_ITEM_GS_CHARCOAL",
          "tier": "often"
        },
        {
          "itemId": "DT_ITEM_GS_TWINE",
          "tier": "often"
        },
        {
          "itemId": "DT_ITEM_GS_BLANKET",
          "tier": "often"
        },
        {
          "itemId": "DT_ITEM_GS_POT_COOKING",
          "tier": "often"
        },
        {
          "itemId": "DT_ITEM_GS_KETTLE_CAMP",
          "tier": "often"
        },
        {
          "itemId": "DT_ITEM_GS_CUP",
          "tier": "often"
        },
        {
          "itemId": "DT_ITEM_GS_BOWL",
          "tier": "often"
        },
        {
          "itemId": "DT_ITEM_GS_SPOON",
          "tier": "often"
        },
        {
          "itemId": "DT_ITEM_GS_PLATE_WOOD",
          "tier": "often"
        },
        {
          "itemId": "DT_ITEM_GS_SOAP",
          "tier": "often"
        },
        {
          "itemId": "DT_ITEM_GS_BROOM",
          "tier": "often"
        },
        {
          "itemId": "DT_ITEM_GS_MOP",
          "tier": "often"
        },
        {
          "itemId": "DT_ITEM_GS_BUCKET_WASH",
          "tier": "often"
        },
        {
          "itemId": "DT_ITEM_GS_BOARD_WASH",
          "tier": "often"
        },
        {
          "itemId": "DT_ITEM_GS_CLOTHES_LINE",
          "tier": "often"
        },
        {
          "itemId": "DT_ITEM_GS_BELL",
          "tier": "often"
        },
        {
          "itemId": "DT_ITEM_GS_WATERSKIN",
          "tier": "often"
        },
        {
          "itemId": "DT_ITEM_GS_FLINT_STEEL",
          "tier": "often"
        },
        {
          "itemId": "DT_ITEM_GS_FIREWOOD",
          "tier": "often"
        },
        {
          "itemId": "DT_ITEM_GS_BEDROLL",
          "tier": "often"
        },
        {
          "itemId": "DT_ITEM_GS_MESS_KIT",
          "tier": "often"
        },
        {
          "itemId": "DT_ITEM_GS_RATIONS_TRAVEL",
          "tier": "often"
        }
      ],
      "variants": [
        {
          "id": "DT_TABLE_TAV_ROADSIDE",
          "name": "Roadside Tavern Stock",
          "description": "A curated roadside tavern stock assortment using shared canonical Items. Review quantities and kitchen capacity before applying.",
          "draws": 12,
          "categoryDraws": 3,
          "excludedItems": [
            "DT_ITEM_GS_BARREL",
            "DT_ITEM_GS_BELL",
            "DT_ITEM_GS_BOARD_WASH",
            "DT_ITEM_GS_BROOM",
            "DT_ITEM_GS_BUCKET_WASH",
            "DT_ITEM_GS_CLOTHES_LINE",
            "DT_ITEM_GS_MOP",
            "DT_ITEM_GS_SOAP",
            "DT_ITEM_GS_TWINE",
            "DT_ITEM_TAV_APPLE_BRANDY",
            "DT_ITEM_TAV_APPLE_MEAD",
            "DT_ITEM_TAV_APPLE_PIE_SLICE",
            "DT_ITEM_TAV_BAKED_APPLE",
            "DT_ITEM_TAV_BAKED_BEAN_SUPPER",
            "DT_ITEM_TAV_BAKED_HADDOCK",
            "DT_ITEM_TAV_BERRY_TART",
            "DT_ITEM_TAV_BLACKBERRY_MEAD",
            "DT_ITEM_TAV_BLACKCURRANT_WINE",
            "DT_ITEM_TAV_BRAISED_BEEF_SUPPER",
            "DT_ITEM_TAV_BREAD_PUDDING",
            "DT_ITEM_TAV_BUTTER_POACHED_SHELLFISH",
            "DT_ITEM_TAV_CASK_AGED_GRAIN_SPIRIT",
            "DT_ITEM_TAV_CELEBRATION_SUPPER",
            "DT_ITEM_TAV_CHICKEN_AND_LEEK_SUPPER",
            "DT_ITEM_TAV_CREAM_AND_PRESERVES",
            "DT_ITEM_TAV_DARK_CANE_SPIRIT",
            "DT_ITEM_TAV_DOUBLE_MALT_BEER",
            "DT_ITEM_TAV_DRY_MEADOW_MEAD",
            "DT_ITEM_TAV_DUCK_WITH_CHERRY_SAUCE",
            "DT_ITEM_TAV_EEL_AND_ONION_SUPPER",
            "DT_ITEM_TAV_GRAIN_SPIRIT",
            "DT_ITEM_TAV_GREEN_LEAF_TEA",
            "DT_ITEM_TAV_GRILLED_SARDINES",
            "DT_ITEM_TAV_HEATHER_HONEY_MEAD",
            "DT_ITEM_TAV_HONEY_CUSTARD",
            "DT_ITEM_TAV_HOUSE_HONEY_MEAD",
            "DT_ITEM_TAV_HOUSE_RED_WINE",
            "DT_ITEM_TAV_HOUSE_WHITE_WINE",
            "DT_ITEM_TAV_IMPORTED_OLIVES",
            "DT_ITEM_TAV_IMPORTED_SHEEP_CHEESE",
            "DT_ITEM_TAV_ISLAND_PALM_SPIRIT",
            "DT_ITEM_TAV_JUNIPER_SPIRIT",
            "DT_ITEM_TAV_MULLED_RED_WINE",
            "DT_ITEM_TAV_MUSSELS_IN_CIDER",
            "DT_ITEM_TAV_MUTTON_AND_TURNIP_SUPPER",
            "DT_ITEM_TAV_OAK_AGED_MEAD",
            "DT_ITEM_TAV_OLD_OAK_ALE",
            "DT_ITEM_TAV_ORCHARD_PEAR_WINE",
            "DT_ITEM_TAV_PAN_FRIED_TROUT_SUPPER",
            "DT_ITEM_TAV_PEAR_BRANDY",
            "DT_ITEM_TAV_PEPPERED_VENISON_PLATE",
            "DT_ITEM_TAV_PICKLED_HERRING",
            "DT_ITEM_TAV_PLUM_SPIRIT",
            "DT_ITEM_TAV_POACHED_PEAR",
            "DT_ITEM_TAV_RESERVE_VINEYARD_WINE",
            "DT_ITEM_TAV_RESINED_WHITE_WINE",
            "DT_ITEM_TAV_ROAST_BEEF_WITH_ONIONS",
            "DT_ITEM_TAV_ROAST_CHICKEN_PORTION",
            "DT_ITEM_TAV_ROAST_DUCK_PORTION",
            "DT_ITEM_TAV_ROAST_GOOSE_PORTION",
            "DT_ITEM_TAV_ROAST_MUTTON_WITH_HERBS",
            "DT_ITEM_TAV_ROAST_PORK_WITH_APPLES",
            "DT_ITEM_TAV_ROAST_RABBIT_PORTION",
            "DT_ITEM_TAV_ROAST_ROOT_PLATTER",
            "DT_ITEM_TAV_ROSE_PETAL_MEAD",
            "DT_ITEM_TAV_ROSY_TABLE_WINE",
            "DT_ITEM_TAV_SAFFRON_CHICKEN_PILAF",
            "DT_ITEM_TAV_SAUSAGE_AND_MASH",
            "DT_ITEM_TAV_SOUTHERN_DATE_WINE",
            "DT_ITEM_TAV_SPICED_COCOA",
            "DT_ITEM_TAV_SPICED_HONEY_LIQUEUR",
            "DT_ITEM_TAV_SPICED_POMEGRANATE_DRINK",
            "DT_ITEM_TAV_SPICED_QUAIL_SUPPER",
            "DT_ITEM_TAV_SPICED_WINTER_MEAD",
            "DT_ITEM_TAV_SPICE_CAKE_SLICE",
            "DT_ITEM_TAV_STRONG_BLACK_COFFEE",
            "DT_ITEM_TAV_STUFFED_ARTICHOKE_PLATE",
            "DT_ITEM_TAV_STUFFED_CABBAGE_SUPPER",
            "DT_ITEM_TAV_SWEET_RED_WINE",
            "DT_ITEM_TAV_TRUFFLED_MUSHROOM_PIE",
            "DT_ITEM_TAV_VENISON_JUNIPER_STEW"
          ],
          "overrides": [
            {
              "itemId": "DT_ITEM_TAV_PORK_HAND_PIE",
              "tier": "always"
            },
            {
              "itemId": "DT_ITEM_TAV_BREAD_AND_CHEESE_BUNDLE",
              "tier": "always"
            },
            {
              "itemId": "DT_ITEM_GS_RATIONS_TRAVEL",
              "tier": "always"
            }
          ],
          "merchantNotes": {
            "alwaysStocks": [
              "Pork Hand Pie",
              "Bread and Cheese Bundle",
              "Travel Rations",
              "Drinking Water"
            ],
            "oftenStocks": [
              "ale, beer, non-alcoholic-drinks, hot-drinks",
              "A changing selection of the profile’s permitted menu and supplies"
            ],
            "rarelyStocks": [
              "Luxury cellar orders"
            ]
          }
        },
        {
          "id": "DT_TABLE_TAV_DOCKSIDE",
          "name": "Dockside Tavern Stock",
          "description": "A curated dockside tavern stock assortment using shared canonical Items. Review quantities and kitchen capacity before applying.",
          "draws": 16,
          "categoryDraws": 3,
          "excludedItems": [
            "DT_ITEM_GS_BARREL",
            "DT_ITEM_GS_BEDROLL",
            "DT_ITEM_GS_BELL",
            "DT_ITEM_GS_BLANKET",
            "DT_ITEM_GS_BOARD_WASH",
            "DT_ITEM_GS_BOWL",
            "DT_ITEM_GS_BROOM",
            "DT_ITEM_GS_BUCKET_WASH",
            "DT_ITEM_GS_CLOTHES_LINE",
            "DT_ITEM_GS_CUP",
            "DT_ITEM_GS_FEED_HORSE",
            "DT_ITEM_GS_KETTLE_CAMP",
            "DT_ITEM_GS_MESS_KIT",
            "DT_ITEM_GS_MOP",
            "DT_ITEM_GS_PLATE_WOOD",
            "DT_ITEM_GS_POT_COOKING",
            "DT_ITEM_GS_RATIONS_TRAVEL",
            "DT_ITEM_GS_SOAP",
            "DT_ITEM_GS_SPOON",
            "DT_ITEM_GS_TWINE",
            "DT_ITEM_TAV_APPLE_MEAD",